"Course","Status","From","To","Note"
"Effective Performance in a Business","Moved","C:\Websites\learningmanagementsystem\Images\Course_Images\CourseImages tap\Effective Performance in a Business.webp","C:\Websites\learningmanagementsystem\Images\Course_Images\TAP Courses Webp files\Effective Performance in a Business.webp",""
"Effective Sales: A Masterclass","Moved","C:\Websites\learningmanagementsystem\Images\Course_Images\CourseImages tap\Effective Sales A Masterclass.webp","C:\Websites\learningmanagementsystem\Images\Course_Images\TAP Courses Webp files\Effective Sales A Masterclass.webp",""
"Effective Time Management","Moved","C:\Websites\learningmanagementsystem\Images\Course_Images\CourseImages tap\Effective Time Management.webp","C:\Websites\learningmanagementsystem\Images\Course_Images\TAP Courses Webp files\Effective Time Management.webp",""
"Emotional Intelligence","Moved","C:\Websites\learningmanagementsystem\Images\Course_Images\CourseImages tap\Emotional intelligence.webp","C:\Websites\learningmanagementsystem\Images\Course_Images\TAP Courses Webp files\Emotional intelligence.webp",""
"Employment Relations","Moved","C:\Websites\learningmanagementsystem\Images\Course_Images\CourseImages tap\Employment Relations.webp","C:\Websites\learningmanagementsystem\Images\Course_Images\TAP Courses Webp files\Employment Relations.webp",""
"Empowering Team Members","Moved","C:\Websites\learningmanagementsystem\Images\Course_Images\CourseImages tap\Empowering Team Members.webp","C:\Websites\learningmanagementsystem\Images\Course_Images\TAP Courses Webp files\Empowering Team Members.webp",""
"Entrepreneurial Characteristics","Moved","C:\Websites\learningmanagementsystem\Images\Course_Images\CourseImages tap\Entrepreneurial Characteristics.webp","C:\Websites\learningmanagementsystem\Images\Course_Images\TAP Courses Webp files\Entrepreneurial Characteristics.webp",""
"Everyday Business Functions","Moved","C:\Websites\learningmanagementsystem\Images\Course_Images\CourseImages tap\Everyday Business Functions.webp","C:\Websites\learningmanagementsystem\Images\Course_Images\TAP Courses Webp files\Everyday Business Functions.webp",""
"Exhibitor and Visitor Engagement Management","Moved","C:\Websites\learningmanagementsystem\Images\Course_Images\CourseImages tap\Exhibitor and Visitor Engagement Management.webp","C:\Websites\learningmanagementsystem\Images\Course_Images\TAP Courses Webp files\Exhibitor and Visitor Engagement Management.webp",""
"Explain Basic Health and Safety Principles in and Around the Workplace","Moved","C:\Websites\learningmanagementsystem\Images\Course_Images\CourseImages tap\Explain Basic Health and Safety Principles in and Around the Workplace.webp","C:\Websites\learningmanagementsystem\Images\Course_Images\TAP Courses Webp files\Explain Basic Health and Safety Principles in and Around the Workplace.webp",""
"Explain the Requirements for Becoming a Security Service Provider","Moved","C:\Websites\learningmanagementsystem\Images\Course_Images\CourseImages tap\Explain the Requirements for Becoming a Security Service Provider.webp","C:\Websites\learningmanagementsystem\Images\Course_Images\TAP Courses Webp files\Explain the Requirements for Becoming a Security Service Provider.webp",""
"Exploring Physical Quantities and Geometrical Relationships","Moved","C:\Websites\learningmanagementsystem\Images\Course_Images\CourseImages tap\Exploring Physical Quantities and Geometrical Relationships.webp","C:\Websites\learningmanagementsystem\Images\Course_Images\TAP Courses Webp files\Exploring Physical Quantities and Geometrical Relationships.webp",""
"Facilitator Training","Moved","C:\Websites\learningmanagementsystem\Images\Course_Images\CourseImages tap\Facilitator Training.webp","C:\Websites\learningmanagementsystem\Images\Course_Images\TAP Courses Webp files\Facilitator Training.webp",""
"Factors That Impact on the Bottom Line of a Wholesale and Retail Unit","Moved","C:\Websites\learningmanagementsystem\Images\Course_Images\CourseImages tap\Factors That Impact on the Bottom Line of a Wholesale and Retail Unit.webp","C:\Websites\learningmanagementsystem\Images\Course_Images\TAP Courses Webp files\Factors That Impact on the Bottom Line of a Wholesale and Retail Unit.webp",""
"Fair and Effective Disciplinary Procedures","Moved","C:\Websites\learningmanagementsystem\Images\Course_Images\CourseImages tap\Fair and Effective Disciplinary Procedures.webp","C:\Websites\learningmanagementsystem\Images\Course_Images\TAP Courses Webp files\Fair and Effective Disciplinary Procedures.webp",""
"Finance a New Venture","Moved","C:\Websites\learningmanagementsystem\Images\Course_Images\CourseImages tap\Finance a New Venture.webp","C:\Websites\learningmanagementsystem\Images\Course_Images\TAP Courses Webp files\Finance a New Venture.webp",""
"Finance For Non Financial Managers","Moved","C:\Websites\learningmanagementsystem\Images\Course_Images\CourseImages tap\Finance For Non Financial Managers.webp","C:\Websites\learningmanagementsystem\Images\Course_Images\TAP Courses Webp files\Finance For Non Financial Managers.webp",""
"Financial Advisory and Intermediary Services Act 2002 (FAIS) (Act 37 of 2002)","Moved","C:\Websites\learningmanagementsystem\Images\Course_Images\CourseImages tap\Financial Advisory and Intermediary Services Act 2002 (FAIS) (Act 37 of 2002).webp","C:\Websites\learningmanagementsystem\Images\Course_Images\TAP Courses Webp files\Financial Advisory and Intermediary Services Act 2002 (FAIS) (Act 37 of 2002).webp",""
"Financial Aspects of Personal, Business and National Issues","Moved","C:\Websites\learningmanagementsystem\Images\Course_Images\CourseImages tap\Financial Aspects of Personal, Business and National Issues.webp","C:\Websites\learningmanagementsystem\Images\Course_Images\TAP Courses Webp files\Financial Aspects of Personal, Business and National Issues.webp",""
"Financial Intelligence Centre Act (FICA)","Moved","C:\Websites\learningmanagementsystem\Images\Course_Images\CourseImages tap\Financial Intelligence Centre Act (FICA).webp","C:\Websites\learningmanagementsystem\Images\Course_Images\TAP Courses Webp files\Financial Intelligence Centre Act (FICA).webp",""
"Financial Management Essentials for Entrepreneurs","Moved","C:\Websites\learningmanagementsystem\Images\Course_Images\CourseImages tap\Financial Management Essentials for Entrepreneurs.webp","C:\Websites\learningmanagementsystem\Images\Course_Images\TAP Courses Webp files\Financial Management Essentials for Entrepreneurs.webp",""
"Financial Mathematics & Analysis","Moved","C:\Websites\learningmanagementsystem\Images\Course_Images\CourseImages tap\Financial Mathematics & Analysis.webp","C:\Websites\learningmanagementsystem\Images\Course_Images\TAP Courses Webp files\Financial Mathematics & Analysis.webp",""
"Financial Modeling","Moved","C:\Websites\learningmanagementsystem\Images\Course_Images\CourseImages tap\Financial Modeling.webp","C:\Websites\learningmanagementsystem\Images\Course_Images\TAP Courses Webp files\Financial Modeling.webp",""
"Financial Planning for New Ventures","Moved","C:\Websites\learningmanagementsystem\Images\Course_Images\CourseImages tap\Financial Planning for New Ventures.webp","C:\Websites\learningmanagementsystem\Images\Course_Images\TAP Courses Webp files\Financial Planning for New Ventures.webp",""
"Fire Fighting","Moved","C:\Websites\learningmanagementsystem\Images\Course_Images\CourseImages tap\Fire Fighting.webp","C:\Websites\learningmanagementsystem\Images\Course_Images\TAP Courses Webp files\Fire Fighting.webp",""
"First Aid","Moved","C:\Websites\learningmanagementsystem\Images\Course_Images\CourseImages tap\First Aid.webp","C:\Websites\learningmanagementsystem\Images\Course_Images\TAP Courses Webp files\First Aid.webp",""
"Foundations of English: Building Blocks for Effective Communication","Moved","C:\Websites\learningmanagementsystem\Images\Course_Images\CourseImages tap\Foundations of English Building Blocks for Effective Communication.webp","C:\Websites\learningmanagementsystem\Images\Course_Images\TAP Courses Webp files\Foundations of English Building Blocks for Effective Communication.webp",""
"Fraud Management in the Office","Moved","C:\Websites\learningmanagementsystem\Images\Course_Images\CourseImages tap\Fraud Management in the Office.webp","C:\Websites\learningmanagementsystem\Images\Course_Images\TAP Courses Webp files\Fraud Management in the Office.webp",""
"Fundamentals of International Trade","Moved","C:\Websites\learningmanagementsystem\Images\Course_Images\CourseImages tap\Fundamentals of International Trade.webp","C:\Websites\learningmanagementsystem\Images\Course_Images\TAP Courses Webp files\Fundamentals of International Trade.webp",""
"Gather and Provide Relevant Information to Contribute to Contact Centre Problem Solving","Moved","C:\Websites\learningmanagementsystem\Images\Course_Images\CourseImages tap\Gather and Provide Relevant Information to Contribute to Contact Centre Problem Solving.webp","C:\Websites\learningmanagementsystem\Images\Course_Images\TAP Courses Webp files\Gather and Provide Relevant Information to Contribute to Contact Centre Problem Solving.webp",""
"Give Evidence In Court","Moved","C:\Websites\learningmanagementsystem\Images\Course_Images\CourseImages tap\Give Evidence In Court.webp","C:\Websites\learningmanagementsystem\Images\Course_Images\TAP Courses Webp files\Give Evidence In Court.webp",""
"Google Sheets and Forms","Moved","C:\Websites\learningmanagementsystem\Images\Course_Images\CourseImages tap\Google Sheets and Forms.webp","C:\Websites\learningmanagementsystem\Images\Course_Images\TAP Courses Webp files\Google Sheets and Forms.webp",""
"Hand Over a Serviced Vehicle","Moved","C:\Websites\learningmanagementsystem\Images\Course_Images\CourseImages tap\Hand Over a Serviced Vehicle.webp","C:\Websites\learningmanagementsystem\Images\Course_Images\TAP Courses Webp files\Hand Over a Serviced Vehicle.webp",""
"Handle Complaints and Problems","Moved","C:\Websites\learningmanagementsystem\Images\Course_Images\CourseImages tap\Handle Complaints and Problems.webp","C:\Websites\learningmanagementsystem\Images\Course_Images\TAP Courses Webp files\Handle Complaints and Problems.webp",""
"How to Deal With Depression","Moved","C:\Websites\learningmanagementsystem\Images\Course_Images\CourseImages tap\How to Deal With Depression.webp","C:\Websites\learningmanagementsystem\Images\Course_Images\TAP Courses Webp files\How to Deal With Depression.webp",""
"How to Start Your First Business","Moved","C:\Websites\learningmanagementsystem\Images\Course_Images\CourseImages tap\How to Start Your First Business.webp","C:\Websites\learningmanagementsystem\Images\Course_Images\TAP Courses Webp files\How to Start Your First Business.webp",""
"How to Take Care of a Baby","Moved","C:\Websites\learningmanagementsystem\Images\Course_Images\CourseImages tap\How to Take Care of a Baby.webp","C:\Websites\learningmanagementsystem\Images\Course_Images\TAP Courses Webp files\How to Take Care of a Baby.webp",""
"Identify and Respond to Customer Needs in a Contact Centre","Moved","C:\Websites\learningmanagementsystem\Images\Course_Images\CourseImages tap\Identify and Respond to Customer Needs in a Contact Centre.webp","C:\Websites\learningmanagementsystem\Images\Course_Images\TAP Courses Webp files\Identify and Respond to Customer Needs in a Contact Centre.webp",""
"Identify Customers and Generate Selling Opportunities","Moved","C:\Websites\learningmanagementsystem\Images\Course_Images\CourseImages tap\Identify Customers and Generate Selling Opportunities.webp","C:\Websites\learningmanagementsystem\Images\Course_Images\TAP Courses Webp files\Identify Customers and Generate Selling Opportunities.webp",""
"Identifying Business Opportunities","Moved","C:\Websites\learningmanagementsystem\Images\Course_Images\CourseImages tap\Identifying Business Opportunities.webp","C:\Websites\learningmanagementsystem\Images\Course_Images\TAP Courses Webp files\Identifying Business Opportunities.webp",""
"Implement and Manage Human Resource and Labour Relations Policies and Acts","Moved","C:\Websites\learningmanagementsystem\Images\Course_Images\CourseImages tap\Implement and Manage Human Resource and Labour Relations Policies and Acts.webp","C:\Websites\learningmanagementsystem\Images\Course_Images\TAP Courses Webp files\Implement and Manage Human Resource and Labour Relations Policies and Acts.webp",""
"Implementation Options for Information Technology (IT)","Moved","C:\Websites\learningmanagementsystem\Images\Course_Images\CourseImages tap\Implementation Options for Information Technology (IT).webp","C:\Websites\learningmanagementsystem\Images\Course_Images\TAP Courses Webp files\Implementation Options for Information Technology (IT).webp",""
"Implementing and Maintaining Information Systems","Moved","C:\Websites\learningmanagementsystem\Images\Course_Images\CourseImages tap\Implementing and Maintaining Information Systems.webp","C:\Websites\learningmanagementsystem\Images\Course_Images\TAP Courses Webp files\Implementing and Maintaining Information Systems.webp",""
"Implementing Project Administration Processes","Moved","C:\Websites\learningmanagementsystem\Images\Course_Images\CourseImages tap\Implementing Project Administration Processes.webp","C:\Websites\learningmanagementsystem\Images\Course_Images\TAP Courses Webp files\Implementing Project Administration Processes.webp",""
"Incorporate Batho Pele Principles in Your Work Role","Moved","C:\Websites\learningmanagementsystem\Images\Course_Images\CourseImages tap\Incorporate Batho Pele Principles in Your Work Role.webp","C:\Websites\learningmanagementsystem\Images\Course_Images\TAP Courses Webp files\Incorporate Batho Pele Principles in Your Work Role.webp",""
"Installing a Networked Workstation","Moved","C:\Websites\learningmanagementsystem\Images\Course_Images\CourseImages tap\Installing a Networked Workstation.webp","C:\Websites\learningmanagementsystem\Images\Course_Images\TAP Courses Webp files\Installing a Networked Workstation.webp",""
"Instil in Myself a Personal Contact Centre Culture","Moved","C:\Websites\learningmanagementsystem\Images\Course_Images\CourseImages tap\Instil in Myself a Personal Contact Centre Culture.webp","C:\Websites\learningmanagementsystem\Images\Course_Images\TAP Courses Webp files\Instil in Myself a Personal Contact Centre Culture.webp",""
"Intermediate Excel Assessment","Moved","C:\Websites\learningmanagementsystem\Images\Course_Images\CourseImages tap\Intermediate Excel Assessment.webp","C:\Websites\learningmanagementsystem\Images\Course_Images\TAP Courses Webp files\Intermediate Excel Assessment.webp",""
"Intermediate Microsoft Excel","Moved","C:\Websites\learningmanagementsystem\Images\Course_Images\CourseImages tap\Intermediate Microsoft Excel.webp","C:\Websites\learningmanagementsystem\Images\Course_Images\TAP Courses Webp files\Intermediate Microsoft Excel.webp",""
"Intermediate Microsoft Word","Moved","C:\Websites\learningmanagementsystem\Images\Course_Images\CourseImages tap\Intermediate Microsoft Word.webp","C:\Websites\learningmanagementsystem\Images\Course_Images\TAP Courses Webp files\Intermediate Microsoft Word.webp",""
"Interpret Classification Systems in Order to Organise, Retrieve and Dispose of Records","Moved","C:\Websites\learningmanagementsystem\Images\Course_Images\CourseImages tap\Interpret Classification Systems in Order to Organise, Retrieve and Dispose of Records.webp","C:\Websites\learningmanagementsystem\Images\Course_Images\TAP Courses Webp files\Interpret Classification Systems in Order to Organise, Retrieve and Dispose of Records.webp",""
"Interpreting Financial Reports","Moved","C:\Websites\learningmanagementsystem\Images\Course_Images\CourseImages tap\Interpreting Financial Reports.webp","C:\Websites\learningmanagementsystem\Images\Course_Images\TAP Courses Webp files\Interpreting Financial Reports.webp",""
"Interpreting Literary Texts","Moved","C:\Websites\learningmanagementsystem\Images\Course_Images\CourseImages tap\Interpreting Literary Texts.webp","C:\Websites\learningmanagementsystem\Images\Course_Images\TAP Courses Webp files\Interpreting Literary Texts.webp",""
"Interview Skills Assessment","Moved","C:\Websites\learningmanagementsystem\Images\Course_Images\CourseImages tap\Interview Skills Assessment.webp","C:\Websites\learningmanagementsystem\Images\Course_Images\TAP Courses Webp files\Interview Skills Assessment.webp",""
"Interviewing Skills for Employers","Moved","C:\Websites\learningmanagementsystem\Images\Course_Images\CourseImages tap\Interviewing Skills for Employers.webp","C:\Websites\learningmanagementsystem\Images\Course_Images\TAP Courses Webp files\Interviewing Skills for Employers.webp",""
"Introduce New Staff to the Workplace","Moved","C:\Websites\learningmanagementsystem\Images\Course_Images\CourseImages tap\Introduce New Staff to the Workplace.webp","C:\Websites\learningmanagementsystem\Images\Course_Images\TAP Courses Webp files\Introduce New Staff to the Workplace.webp",""
"Introducing a New Team Member","Moved","C:\Websites\learningmanagementsystem\Images\Course_Images\CourseImages tap\Introducing a New Team Member.webp","C:\Websites\learningmanagementsystem\Images\Course_Images\TAP Courses Webp files\Introducing a New Team Member.webp",""
"Introduction to Computers","Moved","C:\Websites\learningmanagementsystem\Images\Course_Images\CourseImages tap\Introduction to Computers.webp","C:\Websites\learningmanagementsystem\Images\Course_Images\TAP Courses Webp files\Introduction to Computers.webp",""
"Introduction to Labour Law and the Basic Conditions of Employment Act","Moved","C:\Websites\learningmanagementsystem\Images\Course_Images\CourseImages tap\Introduction to Labour Law and the Basic Conditions of Employment Act.webp","C:\Websites\learningmanagementsystem\Images\Course_Images\TAP Courses Webp files\Introduction to Labour Law and the Basic Conditions of Employment Act.webp",""
"IT Business Analysis","Moved","C:\Websites\learningmanagementsystem\Images\Course_Images\CourseImages tap\IT Business Analysis.webp","C:\Websites\learningmanagementsystem\Images\Course_Images\TAP Courses Webp files\IT Business Analysis.webp",""
"IT Solutions Assessment","Moved","C:\Websites\learningmanagementsystem\Images\Course_Images\CourseImages tap\IT Solutions Assessment.webp","C:\Websites\learningmanagementsystem\Images\Course_Images\TAP Courses Webp files\IT Solutions Assessment.webp",""
"IT Support & Customer Care","Moved","C:\Websites\learningmanagementsystem\Images\Course_Images\CourseImages tap\IT Support & Customer Care.webp","C:\Websites\learningmanagementsystem\Images\Course_Images\TAP Courses Webp files\IT Support & Customer Care.webp",""
"IT Support and Enterprise Systems Management","Moved","C:\Websites\learningmanagementsystem\Images\Course_Images\CourseImages tap\IT Support and Enterprise Systems Management.webp","C:\Websites\learningmanagementsystem\Images\Course_Images\TAP Courses Webp files\IT Support and Enterprise Systems Management.webp",""
"IT System Support","Moved","C:\Websites\learningmanagementsystem\Images\Course_Images\CourseImages tap\IT System Support.webp","C:\Websites\learningmanagementsystem\Images\Course_Images\TAP Courses Webp files\IT System Support.webp",""
"Knowledge Management","Moved","C:\Websites\learningmanagementsystem\Images\Course_Images\CourseImages tap\Knowledge Management.webp","C:\Websites\learningmanagementsystem\Images\Course_Images\TAP Courses Webp files\Knowledge Management.webp",""
"LAN Installation and Commissioning","Moved","C:\Websites\learningmanagementsystem\Images\Course_Images\CourseImages tap\LAN Installation and Commissioning.webp","C:\Websites\learningmanagementsystem\Images\Course_Images\TAP Courses Webp files\LAN Installation and Commissioning.webp",""
"Language and Communication in Occupational Learning","Moved","C:\Websites\learningmanagementsystem\Images\Course_Images\CourseImages tap\Language and Communication in Occupational Learning.webp","C:\Websites\learningmanagementsystem\Images\Course_Images\TAP Courses Webp files\Language and Communication in Occupational Learning.webp",""
"Language Proficiency Test (English)","Moved","C:\Websites\learningmanagementsystem\Images\Course_Images\CourseImages tap\Language Proficiency Test (English).webp","C:\Websites\learningmanagementsystem\Images\Course_Images\TAP Courses Webp files\Language Proficiency Test (English).webp",""
"Leadership in Supply Chain Management","Moved","C:\Websites\learningmanagementsystem\Images\Course_Images\CourseImages tap\Leadership in Supply Chain Management.webp","C:\Websites\learningmanagementsystem\Images\Course_Images\TAP Courses Webp files\Leadership in Supply Chain Management.webp",""
"Leadership Theories","Moved","C:\Websites\learningmanagementsystem\Images\Course_Images\CourseImages tap\Leadership Theories.webp","C:\Websites\learningmanagementsystem\Images\Course_Images\TAP Courses Webp files\Leadership Theories.webp",""
"Local Area Network (LAN) Management Issues","Moved","C:\Websites\learningmanagementsystem\Images\Course_Images\CourseImages tap\Local Area Network (LAN) Management Issues.webp","C:\Websites\learningmanagementsystem\Images\Course_Images\TAP Courses Webp files\Local Area Network (LAN) Management Issues.webp",""
"Local Area Network Administration","Moved","C:\Websites\learningmanagementsystem\Images\Course_Images\CourseImages tap\Local Area Network Administration.webp","C:\Websites\learningmanagementsystem\Images\Course_Images\TAP Courses Webp files\Local Area Network Administration.webp",""
"Logical Problem Solving and Error Detection","Moved","C:\Websites\learningmanagementsystem\Images\Course_Images\CourseImages tap\Logical Problem Solving and Error Detection.webp","C:\Websites\learningmanagementsystem\Images\Course_Images\TAP Courses Webp files\Logical Problem Solving and Error Detection.webp",""
"Maintain and Adapt Oral/signed Communication","Moved","C:\Websites\learningmanagementsystem\Images\Course_Images\CourseImages tap\Maintain and Adapt Oralsigned Communication.webp","C:\Websites\learningmanagementsystem\Images\Course_Images\TAP Courses Webp files\Maintain and Adapt Oralsigned Communication.webp",""
"Maintain Stock in the Automotive Sales Retail Industry","Moved","C:\Websites\learningmanagementsystem\Images\Course_Images\CourseImages tap\Maintain Stock in the Automotive Sales Retail Industry.webp","C:\Websites\learningmanagementsystem\Images\Course_Images\TAP Courses Webp files\Maintain Stock in the Automotive Sales Retail Industry.webp",""
"Maintenance of Office Equipment","Moved","C:\Websites\learningmanagementsystem\Images\Course_Images\CourseImages tap\Maintenance of Office Equipment.webp","C:\Websites\learningmanagementsystem\Images\Course_Images\TAP Courses Webp files\Maintenance of Office Equipment.webp",""
"Make Appointments and Control Flow of Customer Vehicles","Moved","C:\Websites\learningmanagementsystem\Images\Course_Images\CourseImages tap\Make Appointments and Control Flow of Customer Vehicles.webp","C:\Websites\learningmanagementsystem\Images\Course_Images\TAP Courses Webp files\Make Appointments and Control Flow of Customer Vehicles.webp",""
"Manage and Communicate Requirements","Moved","C:\Websites\learningmanagementsystem\Images\Course_Images\CourseImages tap\Manage and Communicate Requirements.webp","C:\Websites\learningmanagementsystem\Images\Course_Images\TAP Courses Webp files\Manage and Communicate Requirements.webp",""
"Manage and Supervise Business Analysis","Moved","C:\Websites\learningmanagementsystem\Images\Course_Images\CourseImages tap\Manage and Supervise Business Analysis.webp","C:\Websites\learningmanagementsystem\Images\Course_Images\TAP Courses Webp files\Manage and Supervise Business Analysis.webp",""
"Manage Business Operations","Moved","C:\Websites\learningmanagementsystem\Images\Course_Images\CourseImages tap\Manage Business Operations.webp","C:\Websites\learningmanagementsystem\Images\Course_Images\TAP Courses Webp files\Manage Business Operations.webp",""
"Manage Diversity to Add Value in the Workplace","Moved","C:\Websites\learningmanagementsystem\Images\Course_Images\CourseImages tap\Manage Diversity to Add Value in the Workplace.webp","C:\Websites\learningmanagementsystem\Images\Course_Images\TAP Courses Webp files\Manage Diversity to Add Value in the Workplace.webp",""
"Manage General Administration","Moved","C:\Websites\learningmanagementsystem\Images\Course_Images\CourseImages tap\Manage General Administration.webp","C:\Websites\learningmanagementsystem\Images\Course_Images\TAP Courses Webp files\Manage General Administration.webp",""
"Manage in-bound and/or Out-bound Calls in a Contact Centre","Moved","C:\Websites\learningmanagementsystem\Images\Course_Images\CourseImages tap\Manage in-bound andor Out-bound Calls in a Contact Centre.webp","C:\Websites\learningmanagementsystem\Images\Course_Images\TAP Courses Webp files\Manage in-bound andor Out-bound Calls in a Contact Centre.webp",""
"Manage Personal Finances","Moved","C:\Websites\learningmanagementsystem\Images\Course_Images\CourseImages tap\Manage Personal Finances.webp","C:\Websites\learningmanagementsystem\Images\Course_Images\TAP Courses Webp files\Manage Personal Finances.webp",""
"Manage Project Meetings and Workshops","Moved","C:\Websites\learningmanagementsystem\Images\Course_Images\CourseImages tap\Manage Project Meetings and Workshops.webp","C:\Websites\learningmanagementsystem\Images\Course_Images\TAP Courses Webp files\Manage Project Meetings and Workshops.webp",""
"Managing an Information System in a Business","Moved","C:\Websites\learningmanagementsystem\Images\Course_Images\CourseImages tap\Managing an Information System in a Business.webp","C:\Websites\learningmanagementsystem\Images\Course_Images\TAP Courses Webp files\Managing an Information System in a Business.webp",""
