"Course","Status","From","To","Note"
"Managing Customer Complaints in a Contact Centre","Moved","C:\Websites\learningmanagementsystem\Images\Course_Images\CourseImages tap\Managing Customer Complaints in a Contact Centre.webp","C:\Websites\learningmanagementsystem\Images\Course_Images\TAP Courses Webp files\Managing Customer Complaints in a Contact Centre.webp",""
"Managing of Service Providers","Moved","C:\Websites\learningmanagementsystem\Images\Course_Images\CourseImages tap\Managing of Service Providers.webp","C:\Websites\learningmanagementsystem\Images\Course_Images\TAP Courses Webp files\Managing of Service Providers.webp",""
"Managing Office Supplies","Moved","C:\Websites\learningmanagementsystem\Images\Course_Images\CourseImages tap\Managing Office Supplies.webp","C:\Websites\learningmanagementsystem\Images\Course_Images\TAP Courses Webp files\Managing Office Supplies.webp",""
"Managing Project Documentation","Moved","C:\Websites\learningmanagementsystem\Images\Course_Images\CourseImages tap\Managing Project Documentation.webp","C:\Websites\learningmanagementsystem\Images\Course_Images\TAP Courses Webp files\Managing Project Documentation.webp",""
"Managing Supply Chain Relationships","Moved","C:\Websites\learningmanagementsystem\Images\Course_Images\CourseImages tap\Managing Supply Chain Relationships.webp","C:\Websites\learningmanagementsystem\Images\Course_Images\TAP Courses Webp files\Managing Supply Chain Relationships.webp",""
"Managing Workplace Conflicts","Moved","C:\Websites\learningmanagementsystem\Images\Course_Images\CourseImages tap\Managing Workplace Conflicts.webp","C:\Websites\learningmanagementsystem\Images\Course_Images\TAP Courses Webp files\Managing Workplace Conflicts.webp",""
"Mastering Cv Construction and Interview Skills","Moved","C:\Websites\learningmanagementsystem\Images\Course_Images\CourseImages tap\Mastering Cv Construction and Interview Skills.webp","C:\Websites\learningmanagementsystem\Images\Course_Images\TAP Courses Webp files\Mastering Cv Construction and Interview Skills.webp",""
"Mastering Disciplinary Hearings: A Comprehensive Guide","Moved","C:\Websites\learningmanagementsystem\Images\Course_Images\CourseImages tap\Mastering Disciplinary Hearings A Comprehensive Guide.webp","C:\Websites\learningmanagementsystem\Images\Course_Images\TAP Courses Webp files\Mastering Disciplinary Hearings A Comprehensive Guide.webp",""
"Match New Venture Opportunity to Market Needs","Moved","C:\Websites\learningmanagementsystem\Images\Course_Images\CourseImages tap\Match New Venture Opportunity to Market Needs.webp","C:\Websites\learningmanagementsystem\Images\Course_Images\TAP Courses Webp files\Match New Venture Opportunity to Market Needs.webp",""
"Mathematical Analysis in Economics and Finance","Moved","C:\Websites\learningmanagementsystem\Images\Course_Images\CourseImages tap\Mathematical Analysis in Economics and Finance.webp","C:\Websites\learningmanagementsystem\Images\Course_Images\TAP Courses Webp files\Mathematical Analysis in Economics and Finance.webp",""
"Meet Performance Standards Within a Contact Centre","Moved","C:\Websites\learningmanagementsystem\Images\Course_Images\CourseImages tap\Meet Performance Standards Within a Contact Centre.webp","C:\Websites\learningmanagementsystem\Images\Course_Images\TAP Courses Webp files\Meet Performance Standards Within a Contact Centre.webp",""
"Merchandise and display products, services and related goods","Moved","C:\Websites\learningmanagementsystem\Images\Course_Images\CourseImages tap\Merchandise and display products, services and related goods.webp","C:\Websites\learningmanagementsystem\Images\Course_Images\TAP Courses Webp files\Merchandise and display products, services and related goods.webp",""
"Microsoft Outlook","Moved","C:\Websites\learningmanagementsystem\Images\Course_Images\CourseImages tap\Microsoft Outlook.webp","C:\Websites\learningmanagementsystem\Images\Course_Images\TAP Courses Webp files\Microsoft Outlook.webp",""
"Microsoft Teams","Moved","C:\Websites\learningmanagementsystem\Images\Course_Images\CourseImages tap\Microsoft Teams.webp","C:\Websites\learningmanagementsystem\Images\Course_Images\TAP Courses Webp files\Microsoft Teams.webp",""
"Microsoft Visual Basic for Excel","Moved","C:\Websites\learningmanagementsystem\Images\Course_Images\CourseImages tap\Microsoft Visual Basic for Excel.webp","C:\Websites\learningmanagementsystem\Images\Course_Images\TAP Courses Webp files\Microsoft Visual Basic for Excel.webp",""
"Moderator","Moved","C:\Websites\learningmanagementsystem\Images\Course_Images\CourseImages tap\Moderator.webp","C:\Websites\learningmanagementsystem\Images\Course_Images\TAP Courses Webp files\Moderator.webp",""
"Monitor, Assess and Manage Risk","Moved","C:\Websites\learningmanagementsystem\Images\Course_Images\CourseImages tap\Monitor, Assess and Manage Risk.webp","C:\Websites\learningmanagementsystem\Images\Course_Images\TAP Courses Webp files\Monitor, Assess and Manage Risk.webp",""
"Motivational Theories and Principles in Leadership","Moved","C:\Websites\learningmanagementsystem\Images\Course_Images\CourseImages tap\Motivational Theories and Principles in Leadership.webp","C:\Websites\learningmanagementsystem\Images\Course_Images\TAP Courses Webp files\Motivational Theories and Principles in Leadership.webp",""
"Motor Vehicle Learner's License - K53","Moved","C:\Websites\learningmanagementsystem\Images\Course_Images\CourseImages tap\Motor Vehicle Learner's License - K53.webp","C:\Websites\learningmanagementsystem\Images\Course_Images\TAP Courses Webp files\Motor Vehicle Learner's License - K53.webp",""
"Motorcycle Learner's License - K53","Moved","C:\Websites\learningmanagementsystem\Images\Course_Images\CourseImages tap\Motorcycle Learner's License - K53.webp","C:\Websites\learningmanagementsystem\Images\Course_Images\TAP Courses Webp files\Motorcycle Learner's License - K53.webp",""
"Multi-User Computer System Security Administration","Moved","C:\Websites\learningmanagementsystem\Images\Course_Images\CourseImages tap\Multi-User Computer System Security Administration.webp","C:\Websites\learningmanagementsystem\Images\Course_Images\TAP Courses Webp files\Multi-User Computer System Security Administration.webp",""
"Multi-User Operating System Management","Moved","C:\Websites\learningmanagementsystem\Images\Course_Images\CourseImages tap\Multi-User Operating System Management.webp","C:\Websites\learningmanagementsystem\Images\Course_Images\TAP Courses Webp files\Multi-User Operating System Management.webp",""
"Negotiation Skills","Moved","C:\Websites\learningmanagementsystem\Images\Course_Images\CourseImages tap\Negotiation Skills.webp","C:\Websites\learningmanagementsystem\Images\Course_Images\TAP Courses Webp files\Negotiation Skills.webp",""
"Negotiation Skills in Business","Moved","C:\Websites\learningmanagementsystem\Images\Course_Images\CourseImages tap\Negotiation Skills in Business.webp","C:\Websites\learningmanagementsystem\Images\Course_Images\TAP Courses Webp files\Negotiation Skills in Business.webp",""
"New Venture Marketing Strategies","Moved","C:\Websites\learningmanagementsystem\Images\Course_Images\CourseImages tap\New Venture Marketing Strategies.webp","C:\Websites\learningmanagementsystem\Images\Course_Images\TAP Courses Webp files\New Venture Marketing Strategies.webp",""
"Numerical Reasoning Assessment","Moved","C:\Websites\learningmanagementsystem\Images\Course_Images\CourseImages tap\Numerical Reasoning Assessment.webp","C:\Websites\learningmanagementsystem\Images\Course_Images\TAP Courses Webp files\Numerical Reasoning Assessment.webp",""
"Occupational Health and Safety","Moved","C:\Websites\learningmanagementsystem\Images\Course_Images\CourseImages tap\Occupational Health and Safety.webp","C:\Websites\learningmanagementsystem\Images\Course_Images\TAP Courses Webp files\Occupational Health and Safety.webp",""
"Office Etiquette","Moved","C:\Websites\learningmanagementsystem\Images\Course_Images\CourseImages tap\Office Etiquette.webp","C:\Websites\learningmanagementsystem\Images\Course_Images\TAP Courses Webp files\Office Etiquette.webp",""
"Office Local Area Network (LAN) Design","Moved","C:\Websites\learningmanagementsystem\Images\Course_Images\CourseImages tap\Office Local Area Network (LAN) Design.webp","C:\Websites\learningmanagementsystem\Images\Course_Images\TAP Courses Webp files\Office Local Area Network (LAN) Design.webp",""
"Operational Planning","Moved","C:\Websites\learningmanagementsystem\Images\Course_Images\CourseImages tap\Operational Planning.webp","C:\Websites\learningmanagementsystem\Images\Course_Images\TAP Courses Webp files\Operational Planning.webp",""
"Optimising Supply Chain Information","Moved","C:\Websites\learningmanagementsystem\Images\Course_Images\CourseImages tap\Optimising Supply Chain Information.webp","C:\Websites\learningmanagementsystem\Images\Course_Images\TAP Courses Webp files\Optimising Supply Chain Information.webp",""
"Optimising Supply Chain Performance","Moved","C:\Websites\learningmanagementsystem\Images\Course_Images\CourseImages tap\Optimising Supply Chain Performance.webp","C:\Websites\learningmanagementsystem\Images\Course_Images\TAP Courses Webp files\Optimising Supply Chain Performance.webp",""
"Oral Communication and Text Evaluation","Moved","C:\Websites\learningmanagementsystem\Images\Course_Images\CourseImages tap\Oral Communication and Text Evaluation.webp","C:\Websites\learningmanagementsystem\Images\Course_Images\TAP Courses Webp files\Oral Communication and Text Evaluation.webp",""
"Oversee and Share Project Timelines","Moved","C:\Websites\learningmanagementsystem\Images\Course_Images\CourseImages tap\Oversee and Share Project Timelines.webp","C:\Websites\learningmanagementsystem\Images\Course_Images\TAP Courses Webp files\Oversee and Share Project Timelines.webp",""
"Participate in the Estimation and Preparation of Cost Budget for a Project or Sub-project and Monitor and Control Actual Cost Against Budget","Moved","C:\Websites\learningmanagementsystem\Images\Course_Images\CourseImages tap\Participate in the Estimation and Preparation of Cost Budget for a Project or Sub-project and Monitor and Control Actual Cost Against Budget.webp","C:\Websites\learningmanagementsystem\Images\Course_Images\TAP Courses Webp files\Participate in the Estimation and Preparation of Cost Budget for a Project or Sub-project and Monitor and Control Actual Cost Against Budget.webp",""
"Perform Basic Business Calculations","Moved","C:\Websites\learningmanagementsystem\Images\Course_Images\CourseImages tap\Perform Basic Business Calculations.webp","C:\Websites\learningmanagementsystem\Images\Course_Images\TAP Courses Webp files\Perform Basic Business Calculations.webp",""
"Perform Basic Fire Fighting","Moved","C:\Websites\learningmanagementsystem\Images\Course_Images\CourseImages tap\Perform Basic Fire Fighting.webp","C:\Websites\learningmanagementsystem\Images\Course_Images\TAP Courses Webp files\Perform Basic Fire Fighting.webp",""
"Perform Hand Over and Take Over Responsibilities","Moved","C:\Websites\learningmanagementsystem\Images\Course_Images\CourseImages tap\Perform Hand Over and Take Over Responsibilities.webp","C:\Websites\learningmanagementsystem\Images\Course_Images\TAP Courses Webp files\Perform Hand Over and Take Over Responsibilities.webp",""
"Perform Requirements Analysis","Moved","C:\Websites\learningmanagementsystem\Images\Course_Images\CourseImages tap\Perform Requirements Analysis.webp","C:\Websites\learningmanagementsystem\Images\Course_Images\TAP Courses Webp files\Perform Requirements Analysis.webp",""
"Performance Standards and Review Processes","Moved","C:\Websites\learningmanagementsystem\Images\Course_Images\CourseImages tap\Performance Standards and Review Processes.webp","C:\Websites\learningmanagementsystem\Images\Course_Images\TAP Courses Webp files\Performance Standards and Review Processes.webp",""
"Personal Development","Moved","C:\Websites\learningmanagementsystem\Images\Course_Images\CourseImages tap\Personal Development.webp","C:\Websites\learningmanagementsystem\Images\Course_Images\TAP Courses Webp files\Personal Development.webp",""
"Philosophy of Supply Chain Management","Moved","C:\Websites\learningmanagementsystem\Images\Course_Images\CourseImages tap\Philosophy of Supply Chain Management.webp","C:\Websites\learningmanagementsystem\Images\Course_Images\TAP Courses Webp files\Philosophy of Supply Chain Management.webp",""
"Plan and Manage Production/Operations in a New Venture","Moved","C:\Websites\learningmanagementsystem\Images\Course_Images\CourseImages tap\Plan and Manage ProductionOperations in a New Venture.webp","C:\Websites\learningmanagementsystem\Images\Course_Images\TAP Courses Webp files\Plan and Manage ProductionOperations in a New Venture.webp",""
"Plan and Prepare Meeting Communications","Moved","C:\Websites\learningmanagementsystem\Images\Course_Images\CourseImages tap\Plan and Prepare Meeting Communications.webp","C:\Websites\learningmanagementsystem\Images\Course_Images\TAP Courses Webp files\Plan and Prepare Meeting Communications.webp",""
"Prepare and Deliver a Purchased Vehicle to a Customer","Moved","C:\Websites\learningmanagementsystem\Images\Course_Images\CourseImages tap\Prepare and Deliver a Purchased Vehicle to a Customer.webp","C:\Websites\learningmanagementsystem\Images\Course_Images\TAP Courses Webp files\Prepare and Deliver a Purchased Vehicle to a Customer.webp",""
"Present Information in Report Format","Moved","C:\Websites\learningmanagementsystem\Images\Course_Images\CourseImages tap\Present Information in Report Format.webp","C:\Websites\learningmanagementsystem\Images\Course_Images\TAP Courses Webp files\Present Information in Report Format.webp",""
"Process Data Using Information Technology","Moved","C:\Websites\learningmanagementsystem\Images\Course_Images\CourseImages tap\Process Data Using Information Technology.webp","C:\Websites\learningmanagementsystem\Images\Course_Images\TAP Courses Webp files\Process Data Using Information Technology.webp",""
"Process Facilitation in Supply Chain Information Integration","Moved","C:\Websites\learningmanagementsystem\Images\Course_Images\CourseImages tap\Process Facilitation in Supply Chain Information Integration.webp","C:\Websites\learningmanagementsystem\Images\Course_Images\TAP Courses Webp files\Process Facilitation in Supply Chain Information Integration.webp",""
"Process Incoming and Outgoing Telephone Calls","Moved","C:\Websites\learningmanagementsystem\Images\Course_Images\CourseImages tap\Process Incoming and Outgoing Telephone Calls.webp","C:\Websites\learningmanagementsystem\Images\Course_Images\TAP Courses Webp files\Process Incoming and Outgoing Telephone Calls.webp",""
"Process Vehicle Service or Repair Requests","Moved","C:\Websites\learningmanagementsystem\Images\Course_Images\CourseImages tap\Process Vehicle Service or Repair Requests.webp","C:\Websites\learningmanagementsystem\Images\Course_Images\TAP Courses Webp files\Process Vehicle Service or Repair Requests.webp",""
"Processing of Automotive Orders and Payments","Moved","C:\Websites\learningmanagementsystem\Images\Course_Images\CourseImages tap\Processing of Automotive Orders and Payments.webp","C:\Websites\learningmanagementsystem\Images\Course_Images\TAP Courses Webp files\Processing of Automotive Orders and Payments.webp",""
"Processing Transactions: Petty Cash and Banking","Moved","C:\Websites\learningmanagementsystem\Images\Course_Images\CourseImages tap\Processing Transactions Petty Cash and Banking.webp","C:\Websites\learningmanagementsystem\Images\Course_Images\TAP Courses Webp files\Processing Transactions Petty Cash and Banking.webp",""
"Produce a Business Plan for a New Venture","Moved","C:\Websites\learningmanagementsystem\Images\Course_Images\CourseImages tap\Produce a Business Plan for a New Venture.webp","C:\Websites\learningmanagementsystem\Images\Course_Images\TAP Courses Webp files\Produce a Business Plan for a New Venture.webp",""
"Professional Conduct and Ethics in the Workplace","Moved","C:\Websites\learningmanagementsystem\Images\Course_Images\CourseImages tap\Professional Conduct and Ethics in the Workplace.webp","C:\Websites\learningmanagementsystem\Images\Course_Images\TAP Courses Webp files\Professional Conduct and Ethics in the Workplace.webp",""
"Professional Interaction Techniques","Moved","C:\Websites\learningmanagementsystem\Images\Course_Images\CourseImages tap\Professional Interaction Techniques.webp","C:\Websites\learningmanagementsystem\Images\Course_Images\TAP Courses Webp files\Professional Interaction Techniques.webp",""
"Project Budget Preparation and Management","Moved","C:\Websites\learningmanagementsystem\Images\Course_Images\CourseImages tap\Project Budget Preparation and Management.webp","C:\Websites\learningmanagementsystem\Images\Course_Images\TAP Courses Webp files\Project Budget Preparation and Management.webp",""
"Project Management Fundamentals","Moved","C:\Websites\learningmanagementsystem\Images\Course_Images\CourseImages tap\Project Management Fundamentals.webp","C:\Websites\learningmanagementsystem\Images\Course_Images\TAP Courses Webp files\Project Management Fundamentals.webp",""
"Promote a Learning Culture","Moved","C:\Websites\learningmanagementsystem\Images\Course_Images\CourseImages tap\Promote a Learning Culture.webp","C:\Websites\learningmanagementsystem\Images\Course_Images\TAP Courses Webp files\Promote a Learning Culture.webp",""
"Protection of Personal Information Act","Moved","C:\Websites\learningmanagementsystem\Images\Course_Images\CourseImages tap\Protection of Personal Information Act.webp","C:\Websites\learningmanagementsystem\Images\Course_Images\TAP Courses Webp files\Protection of Personal Information Act.webp",""
"Provide Information to Customers in a Contact Centre","Moved","C:\Websites\learningmanagementsystem\Images\Course_Images\CourseImages tap\Provide Information to Customers in a Contact Centre.webp","C:\Websites\learningmanagementsystem\Images\Course_Images\TAP Courses Webp files\Provide Information to Customers in a Contact Centre.webp",""
"Public Speaking","Moved","C:\Websites\learningmanagementsystem\Images\Course_Images\CourseImages tap\Public Speaking.webp","C:\Websites\learningmanagementsystem\Images\Course_Images\TAP Courses Webp files\Public Speaking.webp",""
"Rational and Irrational Numbers and Number Systems","Moved","C:\Websites\learningmanagementsystem\Images\Course_Images\CourseImages tap\Rational and Irrational Numbers and Number Systems.webp","C:\Websites\learningmanagementsystem\Images\Course_Images\TAP Courses Webp files\Rational and Irrational Numbers and Number Systems.webp",""
"Reading, Analysing, and Responding to Texts","Moved","C:\Websites\learningmanagementsystem\Images\Course_Images\CourseImages tap\Reading, Analysing, and Responding to Texts.webp","C:\Websites\learningmanagementsystem\Images\Course_Images\TAP Courses Webp files\Reading, Analysing, and Responding to Texts.webp",""
"Reception Management Skills","Moved","C:\Websites\learningmanagementsystem\Images\Course_Images\CourseImages tap\Reception Management Skills.webp","C:\Websites\learningmanagementsystem\Images\Course_Images\TAP Courses Webp files\Reception Management Skills.webp",""
"Recruitment","Moved","C:\Websites\learningmanagementsystem\Images\Course_Images\CourseImages tap\Recruitment.webp","C:\Websites\learningmanagementsystem\Images\Course_Images\TAP Courses Webp files\Recruitment.webp",""
"Research the Viability of New Venture Ideas/Opportunities","Moved","C:\Websites\learningmanagementsystem\Images\Course_Images\CourseImages tap\Research the Viability of New Venture IdeasOpportunities.webp","C:\Websites\learningmanagementsystem\Images\Course_Images\TAP Courses Webp files\Research the Viability of New Venture IdeasOpportunities.webp",""
"Research Using Computer Technology","Moved","C:\Websites\learningmanagementsystem\Images\Course_Images\CourseImages tap\Research Using Computer Technology.webp","C:\Websites\learningmanagementsystem\Images\Course_Images\TAP Courses Webp files\Research Using Computer Technology.webp",""
"Reviewing Your Retail Sales Performance","Moved","C:\Websites\learningmanagementsystem\Images\Course_Images\CourseImages tap\Reviewing Your Retail Sales Performance.webp","C:\Websites\learningmanagementsystem\Images\Course_Images\TAP Courses Webp files\Reviewing Your Retail Sales Performance.webp",""
"Sell Products to Customers in a Wholesale and Retail Outlet","Moved","C:\Websites\learningmanagementsystem\Images\Course_Images\CourseImages tap\Sell Products to Customers in a Wholesale and Retail Outlet.webp","C:\Websites\learningmanagementsystem\Images\Course_Images\TAP Courses Webp files\Sell Products to Customers in a Wholesale and Retail Outlet.webp",""
"Selling to Corporate Fleet Owners","Moved","C:\Websites\learningmanagementsystem\Images\Course_Images\CourseImages tap\Selling to Corporate Fleet Owners.webp","C:\Websites\learningmanagementsystem\Images\Course_Images\TAP Courses Webp files\Selling to Corporate Fleet Owners.webp",""
"Set Priorities for Team and Personal Tasks","Moved","C:\Websites\learningmanagementsystem\Images\Course_Images\CourseImages tap\Set Priorities for Team and Personal Tasks.webp","C:\Websites\learningmanagementsystem\Images\Course_Images\TAP Courses Webp files\Set Priorities for Team and Personal Tasks.webp",""
"Setting Up Multi-User Network Operating Systems","Moved","C:\Websites\learningmanagementsystem\Images\Course_Images\CourseImages tap\Setting Up Multi-User Network Operating Systems.webp","C:\Websites\learningmanagementsystem\Images\Course_Images\TAP Courses Webp files\Setting Up Multi-User Network Operating Systems.webp",""
"Sexual Harassment","Moved","C:\Websites\learningmanagementsystem\Images\Course_Images\CourseImages tap\Sexual Harassment.webp","C:\Websites\learningmanagementsystem\Images\Course_Images\TAP Courses Webp files\Sexual Harassment.webp",""
"Situational Judgement Assessment","Moved","C:\Websites\learningmanagementsystem\Images\Course_Images\CourseImages tap\Situational Judgement Assessment.webp","C:\Websites\learningmanagementsystem\Images\Course_Images\TAP Courses Webp files\Situational Judgement Assessment.webp",""
"Skills Development Coordination Practices (SDF)","Moved","C:\Websites\learningmanagementsystem\Images\Course_Images\CourseImages tap\Skills Development Coordination Practices (SDF).webp","C:\Websites\learningmanagementsystem\Images\Course_Images\TAP Courses Webp files\Skills Development Coordination Practices (SDF).webp",""
"Solving Problems with Data and Probability","Moved","C:\Websites\learningmanagementsystem\Images\Course_Images\CourseImages tap\Solving Problems with Data and Probability.webp","C:\Websites\learningmanagementsystem\Images\Course_Images\TAP Courses Webp files\Solving Problems with Data and Probability.webp",""
"Specify Heavy Vehicles Options and Add-on Products","Moved","C:\Websites\learningmanagementsystem\Images\Course_Images\CourseImages tap\Specify Heavy Vehicles Options and Add-on Products.webp","C:\Websites\learningmanagementsystem\Images\Course_Images\TAP Courses Webp files\Specify Heavy Vehicles Options and Add-on Products.webp",""
"Speed Typing Test Assessment","Moved","C:\Websites\learningmanagementsystem\Images\Course_Images\CourseImages tap\Speed Typing Test Assessment.webp","C:\Websites\learningmanagementsystem\Images\Course_Images\TAP Courses Webp files\Speed Typing Test Assessment.webp",""
"Standard Insurance Cover in Terms of SASRIA","Moved","C:\Websites\learningmanagementsystem\Images\Course_Images\CourseImages tap\Standard Insurance Cover in Terms of SASRIA.webp","C:\Websites\learningmanagementsystem\Images\Course_Images\TAP Courses Webp files\Standard Insurance Cover in Terms of SASRIA.webp",""
"Statistics and Probability to Influence the Use of Data and Procedures","Moved","C:\Websites\learningmanagementsystem\Images\Course_Images\CourseImages tap\Statistics and Probability to Influence the Use of Data and Procedures.webp","C:\Websites\learningmanagementsystem\Images\Course_Images\TAP Courses Webp files\Statistics and Probability to Influence the Use of Data and Procedures.webp",""
"Stock and Fixed Asset Management","Moved","C:\Websites\learningmanagementsystem\Images\Course_Images\CourseImages tap\Stock and Fixed Asset Management.webp","C:\Websites\learningmanagementsystem\Images\Course_Images\TAP Courses Webp files\Stock and Fixed Asset Management.webp",""
"Stock Procurement in the Retail Industry","Moved","C:\Websites\learningmanagementsystem\Images\Course_Images\CourseImages tap\Stock Procurement in the Retail Industry.webp","C:\Websites\learningmanagementsystem\Images\Course_Images\TAP Courses Webp files\Stock Procurement in the Retail Industry.webp",""
"Stock Replenishment in a Retail Business","Moved","C:\Websites\learningmanagementsystem\Images\Course_Images\CourseImages tap\Stock Replenishment in a Retail Business.webp","C:\Websites\learningmanagementsystem\Images\Course_Images\TAP Courses Webp files\Stock Replenishment in a Retail Business.webp",""
"Strategic Financial Planning for Startups","Moved","C:\Websites\learningmanagementsystem\Images\Course_Images\CourseImages tap\Strategic Financial Planning for Startups.webp","C:\Websites\learningmanagementsystem\Images\Course_Images\TAP Courses Webp files\Strategic Financial Planning for Startups.webp",""
"Strategic Supply Chain Management Concepts","Moved","C:\Websites\learningmanagementsystem\Images\Course_Images\CourseImages tap\Strategic Supply Chain Management Concepts.webp","C:\Websites\learningmanagementsystem\Images\Course_Images\TAP Courses Webp files\Strategic Supply Chain Management Concepts.webp",""
