"Course","Status","From","To","Note"
"Strategies to Improve New Venture Performance","Moved","C:\Websites\learningmanagementsystem\Images\Course_Images\CourseImages tap\Strategies to Improve New Venture Performance.webp","C:\Websites\learningmanagementsystem\Images\Course_Images\TAP Courses Webp files\Strategies to Improve New Venture Performance.webp",""
"Stress Management","Moved","C:\Websites\learningmanagementsystem\Images\Course_Images\CourseImages tap\Stress Management.webp","C:\Websites\learningmanagementsystem\Images\Course_Images\TAP Courses Webp files\Stress Management.webp",""
"Supply Chain Negotiation Skills","Moved","C:\Websites\learningmanagementsystem\Images\Course_Images\CourseImages tap\Supply Chain Negotiation Skills.webp","C:\Websites\learningmanagementsystem\Images\Course_Images\TAP Courses Webp files\Supply Chain Negotiation Skills.webp",""
"Support Quality Implementation in Projects","Moved","C:\Websites\learningmanagementsystem\Images\Course_Images\CourseImages tap\Support Quality Implementation in Projects.webp","C:\Websites\learningmanagementsystem\Images\Course_Images\TAP Courses Webp files\Support Quality Implementation in Projects.webp",""
"Talent Management","Moved","C:\Websites\learningmanagementsystem\Images\Course_Images\CourseImages tap\Talent Management.webp","C:\Websites\learningmanagementsystem\Images\Course_Images\TAP Courses Webp files\Talent Management.webp",""
"Tender Procedures for a New Venture","Moved","C:\Websites\learningmanagementsystem\Images\Course_Images\CourseImages tap\Tender Procedures for a New Venture.webp","C:\Websites\learningmanagementsystem\Images\Course_Images\TAP Courses Webp files\Tender Procedures for a New Venture.webp",""
"Testing IT Systems Against Given Specifications","Moved","C:\Websites\learningmanagementsystem\Images\Course_Images\CourseImages tap\Testing IT Systems Against Given Specifications.webp","C:\Websites\learningmanagementsystem\Images\Course_Images\TAP Courses Webp files\Testing IT Systems Against Given Specifications.webp",""
"The Key Issues Important for Compliance With Corporate Governance Principles and Social Responsibility","Moved","C:\Websites\learningmanagementsystem\Images\Course_Images\CourseImages tap\The Key Issues Important for Compliance With Corporate Governance Principles and Social Responsibility.webp","C:\Websites\learningmanagementsystem\Images\Course_Images\TAP Courses Webp files\The Key Issues Important for Compliance With Corporate Governance Principles and Social Responsibility.webp",""
"Time Management","Moved","C:\Websites\learningmanagementsystem\Images\Course_Images\CourseImages tap\Time Management.webp","C:\Websites\learningmanagementsystem\Images\Course_Images\TAP Courses Webp files\Time Management.webp",""
"Tools and Techniques for Project Management","Moved","C:\Websites\learningmanagementsystem\Images\Course_Images\CourseImages tap\Tools and Techniques for Project Management.webp","C:\Websites\learningmanagementsystem\Images\Course_Images\TAP Courses Webp files\Tools and Techniques for Project Management.webp",""
"Train the Trainer","Moved","C:\Websites\learningmanagementsystem\Images\Course_Images\CourseImages tap\Train the Trainer.webp","C:\Websites\learningmanagementsystem\Images\Course_Images\TAP Courses Webp files\Train the Trainer.webp",""
"Troubleshooting Single- and Multi-User OS Issues","Moved","C:\Websites\learningmanagementsystem\Images\Course_Images\CourseImages tap\Troubleshooting Single- and Multi-User OS Issues.webp","C:\Websites\learningmanagementsystem\Images\Course_Images\TAP Courses Webp files\Troubleshooting Single- and Multi-User OS Issues.webp",""
"Understanding Broad-Based Black Economic Empowerment","Moved","C:\Websites\learningmanagementsystem\Images\Course_Images\CourseImages tap\Understanding Broad-Based Black Economic Empowerment.webp","C:\Websites\learningmanagementsystem\Images\Course_Images\TAP Courses Webp files\Understanding Broad-Based Black Economic Empowerment.webp",""
"Understanding Computer Database Management Systems","Moved","C:\Websites\learningmanagementsystem\Images\Course_Images\CourseImages tap\Understanding Computer Database Management Systems.webp","C:\Websites\learningmanagementsystem\Images\Course_Images\TAP Courses Webp files\Understanding Computer Database Management Systems.webp",""
"Understanding Computer Network Architectures and Standards","Moved","C:\Websites\learningmanagementsystem\Images\Course_Images\CourseImages tap\Understanding Computer Network Architectures and Standards.webp","C:\Websites\learningmanagementsystem\Images\Course_Images\TAP Courses Webp files\Understanding Computer Network Architectures and Standards.webp",""
"Understanding Different Business Environments","Moved","C:\Websites\learningmanagementsystem\Images\Course_Images\CourseImages tap\Understanding Different Business Environments.webp","C:\Websites\learningmanagementsystem\Images\Course_Images\TAP Courses Webp files\Understanding Different Business Environments.webp",""
"Understanding Gender-Based Violence","Moved","C:\Websites\learningmanagementsystem\Images\Course_Images\CourseImages tap\Understanding Gender-Based Violence.webp","C:\Websites\learningmanagementsystem\Images\Course_Images\TAP Courses Webp files\Understanding Gender-Based Violence.webp",""
"Understanding HIV/AIDS in the Workplace","Moved","C:\Websites\learningmanagementsystem\Images\Course_Images\CourseImages tap\Understanding HIVAIDS in the Workplace.webp","C:\Websites\learningmanagementsystem\Images\Course_Images\TAP Courses Webp files\Understanding HIVAIDS in the Workplace.webp",""
"Understanding Market Mechanisms in New Ventures","Moved","C:\Websites\learningmanagementsystem\Images\Course_Images\CourseImages tap\Understanding Market Mechanisms in New Ventures.webp","C:\Websites\learningmanagementsystem\Images\Course_Images\TAP Courses Webp files\Understanding Market Mechanisms in New Ventures.webp",""
"Understanding Multi-User Operating Systems","Moved","C:\Websites\learningmanagementsystem\Images\Course_Images\CourseImages tap\Understanding Multi-User Operating Systems.webp","C:\Websites\learningmanagementsystem\Images\Course_Images\TAP Courses Webp files\Understanding Multi-User Operating Systems.webp",""
"Understanding Organisational Ethics","Moved","C:\Websites\learningmanagementsystem\Images\Course_Images\CourseImages tap\Understanding Organisational Ethics.webp","C:\Websites\learningmanagementsystem\Images\Course_Images\TAP Courses Webp files\Understanding Organisational Ethics.webp",""
"Understanding VAT (Value Added Tax)","Moved","C:\Websites\learningmanagementsystem\Images\Course_Images\CourseImages tap\Understanding VAT (Value Added Tax).webp","C:\Websites\learningmanagementsystem\Images\Course_Images\TAP Courses Webp files\Understanding VAT (Value Added Tax).webp",""
"Use Security Equipment","Moved","C:\Websites\learningmanagementsystem\Images\Course_Images\CourseImages tap\Use Security Equipment.webp","C:\Websites\learningmanagementsystem\Images\Course_Images\TAP Courses Webp files\Use Security Equipment.webp",""
"Using Information From Texts","Moved","C:\Websites\learningmanagementsystem\Images\Course_Images\CourseImages tap\Using Information From Texts.webp","C:\Websites\learningmanagementsystem\Images\Course_Images\TAP Courses Webp files\Using Information From Texts.webp",""
"Using Statistics and Probability to Analyse and Communicate Life Problems","Moved","C:\Websites\learningmanagementsystem\Images\Course_Images\CourseImages tap\Using Statistics and Probability to Analyse and Communicate Life Problems.webp","C:\Websites\learningmanagementsystem\Images\Course_Images\TAP Courses Webp files\Using Statistics and Probability to Analyse and Communicate Life Problems.webp",""
"Verbal Reasoning Assessment","Moved","C:\Websites\learningmanagementsystem\Images\Course_Images\CourseImages\Verbal Reasoning Assessment.png","C:\Websites\learningmanagementsystem\Images\Course_Images\TAP Courses Webp files\Verbal Reasoning Assessment.png",""
"WANs vs. LANs: Understanding and Comparison","Moved","C:\Websites\learningmanagementsystem\Images\Course_Images\CourseImages tap\WANs vs. LANs Understanding and Comparison.webp","C:\Websites\learningmanagementsystem\Images\Course_Images\TAP Courses Webp files\WANs vs. LANs Understanding and Comparison.webp",""
"Work as a member of a Contact Centre Team","Moved","C:\Websites\learningmanagementsystem\Images\Course_Images\CourseImages tap\Work as a member of a Contact Centre Team.webp","C:\Websites\learningmanagementsystem\Images\Course_Images\TAP Courses Webp files\Work as a member of a Contact Centre Team.webp",""
"Work as a Project Team Member","Moved","C:\Websites\learningmanagementsystem\Images\Course_Images\CourseImages tap\Work as a Project Team Member.webp","C:\Websites\learningmanagementsystem\Images\Course_Images\TAP Courses Webp files\Work as a Project Team Member.webp",""
"Work Unit Estimation and Late Delivery Implications","Moved","C:\Websites\learningmanagementsystem\Images\Course_Images\CourseImages tap\Work Unit Estimation and Late Delivery Implications.webp","C:\Websites\learningmanagementsystem\Images\Course_Images\TAP Courses Webp files\Work Unit Estimation and Late Delivery Implications.webp",""
"Work With a Range of Patterns and Functions and Solve Problems","Moved","C:\Websites\learningmanagementsystem\Images\Course_Images\CourseImages tap\Work With a Range of Patterns and Functions and Solve Problems.webp","C:\Websites\learningmanagementsystem\Images\Course_Images\TAP Courses Webp files\Work With a Range of Patterns and Functions and Solve Problems.webp",""
"Write/present for a Defined Context","Moved","C:\Websites\learningmanagementsystem\Images\Course_Images\CourseImages tap\Writepresent for a Defined Context.webp","C:\Websites\learningmanagementsystem\Images\Course_Images\TAP Courses Webp files\Writepresent for a Defined Context.webp",""
"Writing for Various Communicative Contexts","Moved","C:\Websites\learningmanagementsystem\Images\Course_Images\CourseImages tap\Writing for Various Communicative Contexts.webp","C:\Websites\learningmanagementsystem\Images\Course_Images\TAP Courses Webp files\Writing for Various Communicative Contexts.webp",""
